[
  {
    "id": "elon-musk",
    "name": "Elon Musk",
    "contacts": {
      "email": null,
      "fb": null,
      "insta": null,
      "linkedin": null,
      "x": null,
      "other": []
    },
    "companies": [
      {
        "name": "Tesla",
        "role": "ceo",
        "url": "https://www.tesla.com/",
        "primary": true
      },
      {
        "name": "SpaceX",
        "role": "founder",
        "url": "https://www.spacex.com/",
        "primary": false
      },
      {
        "name": "X",
        "role": "owner",
        "url": "https://x.com/",
        "primary": false
      }
    ],
    "climate": {
      "score": 6,
      "confidence": "medium",
      "rationale": "Tesla accelerated EV transition materially; SolarCity/energy storage too. Offset by political alignments hostile to climate policy and heavy personal jet use — the score is contested and should be argued.",
      "sources": [
        {
          "label": "Tesla Impact Report",
          "url": "https://www.tesla.com/impact"
        }
      ],
      "as_of": "2026-08-31"
    },
    "meta": {
      "net_worth_usd_b": 240,
      "source_of_wealth": "Tesla, SpaceX",
      "country": "United States",
      "born": 1971,
      "gender": "m",
      "source": {
        "label": "Forbes real-time billionaires",
        "url": "https://www.forbes.com/real-time-billionaires/"
      }
    },
    "outreach": {
      "status": "needs_research",
      "angle": "Frame as the accelerationist case: the treaty funds the transition Tesla exists to sell into. High-risk, high-variance contact.",
      "owner": null,
      "channel": null,
      "last_contact": null,
      "notes": [
        "Score is the most disputable on the seed list — good candidate for the Telegram re-scoring."
      ]
    },
    "updated": "2026-08-31"
  },
  {
    "id": "jeff-bezos",
    "name": "Jeff Bezos",
    "contacts": {
      "email": null,
      "fb": null,
      "insta": null,
      "linkedin": null,
      "x": null,
      "other": [
        {
          "label": "Bezos Earth Fund",
          "url": "https://www.bezosearthfund.org/"
        }
      ]
    },
    "companies": [
      {
        "name": "Amazon",
        "role": "founder",
        "url": "https://www.amazon.com/",
        "primary": true
      },
      {
        "name": "Blue Origin",
        "role": "founder",
        "url": "https://www.blueorigin.com/",
        "primary": false
      }
    ],
    "climate": {
      "score": 7,
      "confidence": "medium",
      "rationale": "Pledged $10B Bezos Earth Fund and the Climate Pledge. Marked down for Amazon's logistics emissions and personal spaceflight/superyacht footprint.",
      "sources": [
        {
          "label": "Bezos Earth Fund",
          "url": "https://www.bezosearthfund.org/"
        }
      ],
      "as_of": "2026-08-31"
    },
    "meta": {
      "net_worth_usd_b": 200,
      "source_of_wealth": "Amazon",
      "country": "United States",
      "born": 1964,
      "gender": "m",
      "source": {
        "label": "Forbes real-time billionaires",
        "url": "https://www.forbes.com/real-time-billionaires/"
      }
    },
    "outreach": {
      "status": "researched",
      "angle": "The $10B pledge is a down payment on the surplus — the treaty is the mechanism that disburses it in ten years instead of a perpetual endowment.",
      "owner": null,
      "channel": "Bezos Earth Fund",
      "last_contact": null,
      "notes": []
    },
    "updated": "2026-08-31"
  },
  {
    "id": "warren-buffett",
    "name": "Warren Buffett",
    "contacts": {
      "email": null,
      "fb": null,
      "insta": null,
      "linkedin": null,
      "x": null,
      "other": [
        {
          "label": "Berkshire Hathaway",
          "url": "https://www.berkshirehathaway.com/"
        }
      ]
    },
    "companies": [
      {
        "name": "Berkshire Hathaway",
        "role": "chair",
        "url": "https://www.berkshirehathaway.com/",
        "primary": true
      }
    ],
    "climate": {
      "score": 4,
      "confidence": "medium",
      "rationale": "Giving Pledge co-founder and a committed disburser of his fortune, but Berkshire Hathaway Energy retains significant coal and BHE has resisted faster decarbonisation timelines.",
      "sources": [
        {
          "label": "Giving Pledge",
          "url": "https://givingpledge.org/"
        }
      ],
      "as_of": "2026-08-31"
    },
    "meta": {
      "net_worth_usd_b": 140,
      "source_of_wealth": "Berkshire Hathaway",
      "country": "United States",
      "born": 1930,
      "gender": "m",
      "source": {
        "label": "Forbes real-time billionaires",
        "url": "https://www.forbes.com/real-time-billionaires/"
      }
    },
    "outreach": {
      "status": "researched",
      "angle": "Already committed to giving nearly all of it away — the treaty just adds a clock and a destination. Natural philosophical ally.",
      "owner": null,
      "channel": "Giving Pledge network",
      "last_contact": null,
      "notes": []
    },
    "updated": "2026-08-31"
  },
  {
    "id": "bill-gates",
    "name": "Bill Gates",
    "contacts": {
      "email": null,
      "fb": null,
      "insta": null,
      "linkedin": null,
      "x": null,
      "other": [
        {
          "label": "Gates Foundation contact",
          "url": "https://www.gatesfoundation.org/about/contact-us"
        }
      ]
    },
    "companies": [
      {
        "name": "Breakthrough Energy",
        "role": "founder",
        "url": "https://www.breakthroughenergy.org/",
        "primary": false
      },
      {
        "name": "Microsoft",
        "role": "cofounder",
        "url": "https://www.microsoft.com/",
        "primary": true
      },
      {
        "name": "TerraPower",
        "role": "chair",
        "url": "https://www.terrapower.com/",
        "primary": false
      }
    ],
    "climate": {
      "score": 8,
      "confidence": "high",
      "rationale": "Founded Breakthrough Energy and its multi-billion catalyst fund; backs advanced nuclear and climate R&D. Marked down from 10 for personal aviation footprint and a technology-not-degrowth stance some contest.",
      "sources": [
        {
          "label": "Breakthrough Energy",
          "url": "https://www.breakthroughenergy.org/"
        }
      ],
      "as_of": "2026-08-31"
    },
    "meta": {
      "net_worth_usd_b": 110,
      "source_of_wealth": "Microsoft",
      "country": "United States",
      "born": 1955,
      "gender": "m",
      "source": {
        "label": "Forbes real-time billionaires",
        "url": "https://www.forbes.com/real-time-billionaires/"
      }
    },
    "outreach": {
      "status": "researched",
      "angle": "Already the archetype the treaty describes — frame it as institutionalising what Breakthrough does, with a public register that pressures peers.",
      "owner": null,
      "channel": "Breakthrough Energy / Gates Foundation program staff",
      "last_contact": null,
      "notes": []
    },
    "updated": "2026-08-31"
  },
  {
    "id": "michael-bloomberg",
    "name": "Michael Bloomberg",
    "contacts": {
      "email": null,
      "fb": null,
      "insta": null,
      "linkedin": null,
      "x": null,
      "other": [
        {
          "label": "Bloomberg Philanthropies",
          "url": "https://www.bloomberg.org/"
        }
      ]
    },
    "companies": [
      {
        "name": "Bloomberg L.P.",
        "role": "founder",
        "url": "https://www.bloomberg.com/company/",
        "primary": true,
        "socials": []
      }
    ],
    "climate": {
      "score": 9,
      "confidence": "high",
      "rationale": "Funded Beyond Coal, UN climate finance envoy, one of the largest private climate funders alive. Not a 10 only because the fortune itself is not climate-derived.",
      "sources": [
        {
          "label": "Bloomberg Philanthropies — Environment",
          "url": "https://www.bloomberg.org/environment/"
        }
      ],
      "as_of": "2026-08-31"
    },
    "meta": {
      "net_worth_usd_b": 105,
      "source_of_wealth": "Bloomberg L.P.",
      "country": "United States",
      "born": 1942,
      "gender": "m",
      "source": {
        "label": "Forbes real-time billionaires",
        "url": "https://www.forbes.com/real-time-billionaires/"
      }
    },
    "outreach": {
      "status": "researched",
      "angle": "Cap-and-commit is the logical next step from Beyond Coal; offer a founding council seat.",
      "owner": null,
      "channel": "Bloomberg Philanthropies environment team",
      "last_contact": null,
      "notes": []
    },
    "updated": "2026-08-31"
  },
  {
    "id": "mukesh-ambani",
    "name": "Mukesh Ambani",
    "contacts": {
      "email": null,
      "fb": null,
      "insta": null,
      "linkedin": null,
      "x": null,
      "other": []
    },
    "companies": [
      {
        "name": "Reliance Industries",
        "role": "chair",
        "url": "https://www.ril.com/",
        "primary": true
      }
    ],
    "climate": {
      "score": 4,
      "confidence": "low",
      "rationale": "Fortune is oil-and-gas rooted, but Reliance has pledged a large green-energy buildout (solar, hydrogen, storage) with a net-zero-by-2035 target. Score reflects the tension between the two.",
      "sources": [
        {
          "label": "Reliance — New Energy",
          "url": "https://www.ril.com/businesses/new-energy-materials"
        }
      ],
      "as_of": "2026-08-31"
    },
    "meta": {
      "net_worth_usd_b": 100,
      "source_of_wealth": "Reliance Industries",
      "country": "India",
      "born": 1957,
      "gender": "m",
      "source": {
        "label": "Forbes real-time billionaires",
        "url": "https://www.forbes.com/real-time-billionaires/"
      }
    },
    "outreach": {
      "status": "needs_research",